{
  "$schema": "https://json-schema.org/draft/2020-12/schema",
  "$id": "urn:fatwa:s3:contract-inventory:1",
  "title": "Offline non-executable contract inventory",
  "type": "object",
  "properties": {
    "schema_version": {
      "const": "1.0",
      "x-error-code": "UNSUPPORTED_SCHEMA"
    },
    "fixture_kind": {
      "enum": [
        "SYNTHETIC",
        "SOURCE_INVENTORY"
      ]
    },
    "policy": {
      "type": "object",
      "properties": {
        "policy_token": {
          "const": "D-067:D-068:U03-U10:OWNER_APPROVAL_PENDING:20261013",
          "x-error-code": "STALE_POLICY_TOKEN"
        },
        "owner_approval": {
          "const": "OWNER_APPROVAL_PENDING",
          "x-error-code": "POLICY_ACTIVATION_FORBIDDEN"
        },
        "gate_b": {
          "const": "NOT_PASSED",
          "x-error-code": "GATE_ACTIVATION_FORBIDDEN"
        },
        "gates_c_d_e": {
          "const": "HOLD",
          "x-error-code": "GATE_ACTIVATION_FORBIDDEN"
        },
        "phase01": {
          "const": "BLOCKED",
          "x-error-code": "GATE_ACTIVATION_FORBIDDEN"
        },
        "role_hierarchy": {
          "type": "object",
          "properties": {
            "MUFTI": {
              "const": "ADMIN_PEER",
              "x-error-code": "ROLE_ESCALATION"
            },
            "ORGANIZER_ADMIN": {
              "const": "ADMIN_PEER",
              "x-error-code": "ROLE_ESCALATION"
            },
            "ORGANIZER": {
              "const": "CONFIGURABLE_LOWER",
              "x-error-code": "ROLE_ESCALATION"
            }
          },
          "required": [
            "MUFTI",
            "ORGANIZER_ADMIN",
            "ORGANIZER"
          ],
          "additionalProperties": false
        },
        "scholarly_authorities": {
          "const": [
            "MUFTI"
          ],
          "x-error-code": "ROLE_ESCALATION"
        },
        "ai_mode": {
          "const": "DISABLED",
          "x-error-code": "AI_ACTIVATION_FORBIDDEN"
        },
        "inline_citations": {
          "const": "V1_HUMAN_REVIEWED_SUGGESTIONS_DEFERRED",
          "x-error-code": "AI_ACTIVATION_FORBIDDEN"
        },
        "external_chatgpt": {
          "const": "V2_DEFERRED",
          "x-error-code": "AI_ACTIVATION_FORBIDDEN"
        }
      },
      "required": [
        "policy_token",
        "owner_approval",
        "gate_b",
        "gates_c_d_e",
        "phase01",
        "role_hierarchy",
        "scholarly_authorities",
        "ai_mode",
        "inline_citations",
        "external_chatgpt"
      ],
      "additionalProperties": false
    },
    "source_documents": {
      "type": "array",
      "minItems": 1,
      "maxItems": 32,
      "items": {
        "type": "object",
        "properties": {
          "document_id": {
            "type": "string",
            "minLength": 1,
            "maxLength": 200
          },
          "sha256": {
            "type": "string",
            "pattern": "^[a-f0-9]{64}$"
          }
        },
        "required": [
          "document_id",
          "sha256"
        ],
        "additionalProperties": false
      }
    },
    "actions": {
      "type": "array",
      "minItems": 1,
      "maxItems": 70,
      "items": {
        "type": "object",
        "properties": {
          "action_id": {
            "type": "string",
            "minLength": 1,
            "maxLength": 200
          },
          "row_type": {
            "enum": [
              "DOMAIN_STATE",
              "UI"
            ]
          },
          "mapping_status": {
            "enum": [
              "UNMAPPED_HOLD",
              "MAPPED_DRAFT"
            ]
          },
          "record_kind": {
            "enum": [
              "ACTION",
              "INTERNAL_ATOMIC_EFFECT"
            ]
          },
          "operation": {
            "enum": [
              "ADMINISTRATIVE",
              "SCHOLARLY_CREATE",
              "SCHOLARLY_APPROVE",
              "INTERNAL_ATOMIC_EFFECT",
              "OTHER_DOCUMENTED"
            ]
          },
          "deny_default": {
            "const": "DENY_DEFAULT",
            "x-error-code": "GRANT_NOT_DENIED"
          },
          "binding": {
            "const": "NONE_CANDIDATE_BINDING_ONLY",
            "x-error-code": "SHADOW_GRANT"
          },
          "callable": {
            "type": "boolean"
          },
          "parent_transaction": {
            "type": [
              "string",
              "null"
            ],
            "minLength": 1,
            "maxLength": 200
          },
          "source_ref": {
            "type": "object",
            "properties": {
              "document_id": {
                "type": "string",
                "minLength": 1,
                "maxLength": 200
              },
              "record_id": {
                "type": "string",
                "minLength": 1,
                "maxLength": 200
              }
            },
            "required": [
              "document_id",
              "record_id"
            ],
            "additionalProperties": false
          },
          "policy_token": {
            "const": "D-067:D-068:U03-U10:OWNER_APPROVAL_PENDING:20261013",
            "x-error-code": "STALE_POLICY_TOKEN"
          },
          "candidate_principals": {
            "type": "array",
            "maxItems": 3,
            "uniqueItems": true,
            "items": {
              "type": "object",
              "properties": {
                "kind": {
                  "const": "ROLE",
                  "x-error-code": "SERVICE_IDENTITY_IMPERSONATION"
                },
                "name": {
                  "enum": [
                    "MUFTI",
                    "ORGANIZER_ADMIN",
                    "ORGANIZER"
                  ],
                  "x-error-code": "ROLE_ESCALATION"
                }
              },
              "required": [
                "kind",
                "name"
              ],
              "additionalProperties": false
            }
          },
          "grant_effect": {
            "const": "NONE",
            "x-error-code": "SHADOW_GRANT"
          },
          "historical_answer_mutable": {
            "const": false,
            "x-error-code": "MUTABLE_HISTORICAL_ANSWER"
          }
        },
        "required": [
          "action_id",
          "row_type",
          "mapping_status",
          "record_kind",
          "operation",
          "deny_default",
          "binding",
          "callable",
          "parent_transaction",
          "source_ref",
          "policy_token",
          "candidate_principals",
          "grant_effect",
          "historical_answer_mutable"
        ],
        "additionalProperties": false
      }
    },
    "transitions": {
      "type": "array",
      "minItems": 1,
      "maxItems": 58,
      "items": {
        "type": "object",
        "properties": {
          "transition_id": {
            "type": "string",
            "minLength": 1,
            "maxLength": 200
          },
          "from_state": {
            "type": "string",
            "minLength": 1,
            "maxLength": 200
          },
          "to_state": {
            "type": "string",
            "minLength": 1,
            "maxLength": 200
          },
          "action_id": {
            "type": "string",
            "minLength": 1,
            "maxLength": 200
          },
          "enabled": {
            "type": "boolean"
          },
          "source_ref": {
            "type": "object",
            "properties": {
              "document_id": {
                "type": "string",
                "minLength": 1,
                "maxLength": 200
              },
              "record_id": {
                "type": "string",
                "minLength": 1,
                "maxLength": 200
              }
            },
            "required": [
              "document_id",
              "record_id"
            ],
            "additionalProperties": false
          },
          "policy_token": {
            "const": "D-067:D-068:U03-U10:OWNER_APPROVAL_PENDING:20261013",
            "x-error-code": "STALE_POLICY_TOKEN"
          },
          "candidate_principals": {
            "type": "array",
            "maxItems": 3,
            "uniqueItems": true,
            "items": {
              "type": "object",
              "properties": {
                "kind": {
                  "const": "ROLE",
                  "x-error-code": "SERVICE_IDENTITY_IMPERSONATION"
                },
                "name": {
                  "enum": [
                    "MUFTI",
                    "ORGANIZER_ADMIN",
                    "ORGANIZER"
                  ],
                  "x-error-code": "ROLE_ESCALATION"
                }
              },
              "required": [
                "kind",
                "name"
              ],
              "additionalProperties": false
            }
          },
          "grant_effect": {
            "const": "NONE",
            "x-error-code": "SHADOW_GRANT"
          },
          "historical_answer_mutable": {
            "const": false,
            "x-error-code": "MUTABLE_HISTORICAL_ANSWER"
          }
        },
        "required": [
          "transition_id",
          "from_state",
          "to_state",
          "action_id",
          "enabled",
          "source_ref",
          "policy_token",
          "candidate_principals",
          "grant_effect",
          "historical_answer_mutable"
        ],
        "additionalProperties": false
      }
    }
  },
  "required": [
    "schema_version",
    "fixture_kind",
    "policy",
    "source_documents",
    "actions",
    "transitions"
  ],
  "additionalProperties": false
}
